,id,time,event,option1,sector,label,nr_jobs
2355,1570,22.0,Sun MicroSystem,Tech Lead Tech Dev Center,enterprise,enterprise,9
2356,1570,24.0,Sun MicroSystem,Manage Asian Globalization Center,enterprise,enterprise,9
2357,1570,28.0027,Sun MicroSystem,Manage Solaris Eng,enterprise,enterprise,9
2358,1570,30.0055,Sun MicroSystem,Sr Manage Customer Networked Service,enterprise,enterprise,9
2359,1570,32.0055,EMC,Sr Manage Cloud Infrastructure Group,enterprise,enterprise,9
2360,1570,35.0082,EMC,Director Software Eng Mozy,enterprise,enterprise,9
2361,1570,36.0082,VMware,Director Research Dev Mozy,enterprise,enterprise,9
2362,1570,38.010999999999996,EMC,Director Software Eng Data Protection Cloud,enterprise,enterprise,9
2363,1570,39.010999999999996,Symantec,Sr Director Dev Global Targeted ferings fice CTO,enterprise,enterprise,9
